{
  "version": "1",
  "gameId": "fixture-demo",
  "board": [
    0,
    null,
    null,
    null,
    null,
    null,
    null,
    null,
    null,
    null,
    null,
    null,
    null,
    null,
    null,
    null,
    null,
    null,
    null,
    null,
    null,
    null,
    null,
    null,
    null,
    null,
    null,
    128,
    null,
    null,
    null,
    null,
    null,
    null,
    null,
    null,
    null,
    null,
    null,
    null,
    null,
    null,
    null,
    null,
    null,
    null,
    null,
    null,
    null,
    null,
    null,
    null,
    null,
    null,
    255,
    null,
    null,
    null,
    null,
    null,
    null,
    null,
    null,
    null
  ],
  "turnNumber": 12,
  "currentPlayer": "light",
  "nextColor": 176,
  "rngState": 2960853921,
  "consecutivePasses": 0,
  "phase": "playing",
  "winner": null,
  "legalMoves": []
}
