{
  "version": "1",
  "gameId": "fixture-demo",
  "board": [
    182,
    121,
    121,
    122,
    123,
    110,
    107,
    44,
    137,
    102,
    133,
    118,
    143,
    59,
    95,
    57,
    6,
    106,
    104,
    87,
    101,
    101,
    89,
    59,
    98,
    64,
    122,
    109,
    138,
    118,
    101,
    68,
    115,
    91,
    51,
    135,
    100,
    122,
    92,
    67,
    108,
    106,
    125,
    86,
    110,
    103,
    90,
    58,
    109,
    82,
    80,
    86,
    57,
    94,
    94,
    72,
    163,
    102,
    99,
    99,
    99,
    96,
    94,
    33
  ],
  "turnNumber": 60,
  "currentPlayer": "dark",
  "nextColor": 207,
  "rngState": 3477354488,
  "consecutivePasses": 0,
  "phase": "finished",
  "winner": "dark",
  "legalMoves": []
}
