{
  "version": "1",
  "gameId": "fixture-demo",
  "board": [
    null,
    null,
    null,
    null,
    null,
    null,
    null,
    null,
    null,
    null,
    null,
    null,
    null,
    null,
    null,
    null,
    null,
    null,
    null,
    null,
    null,
    null,
    null,
    null,
    null,
    null,
    null,
    0,
    255,
    null,
    null,
    null,
    null,
    null,
    null,
    255,
    0,
    null,
    null,
    null,
    null,
    null,
    null,
    null,
    null,
    null,
    null,
    null,
    null,
    null,
    null,
    null,
    null,
    null,
    null,
    null,
    null,
    null,
    null,
    null,
    null,
    null,
    null,
    null
  ],
  "turnNumber": 0,
  "currentPlayer": "dark",
  "nextColor": 60,
  "rngState": 1015568748,
  "consecutivePasses": 0,
  "phase": "playing",
  "winner": null,
  "legalMoves": [
    {
      "row": 2,
      "col": 2
    },
    {
      "row": 2,
      "col": 3
    },
    {
      "row": 2,
      "col": 4
    },
    {
      "row": 2,
      "col": 5
    },
    {
      "row": 3,
      "col": 2
    },
    {
      "row": 3,
      "col": 5
    },
    {
      "row": 4,
      "col": 2
    },
    {
      "row": 4,
      "col": 5
    },
    {
      "row": 5,
      "col": 2
    },
    {
      "row": 5,
      "col": 3
    },
    {
      "row": 5,
      "col": 4
    },
    {
      "row": 5,
      "col": 5
    }
  ]
}
